{
  "$schema": "http://json-schema.org/draft-07/schema#",
  "title": "ModulPackage",
  "description": "One Modul (thematic umbrella over exactly 3 Lektionen), stored at public/data/<level>/modul-<N>.json. Modul numbers run 1-8 continuously across a level's two half-books; that split is a source-material artifact, not part of this schema.",
  "type": "object",
  "required": ["modulId", "level", "modulNumber", "title", "lektionen"],
  "properties": {
    "modulId": { "type": "string" },
    "level": { "enum": ["A1", "A2", "B1", "B1+"] },
    "modulNumber": { "type": "integer", "minimum": 1, "maximum": 8 },
    "title": { "type": "string" },
    "lektionen": {
      "type": "array",
      "minItems": 3,
      "maxItems": 3,
      "items": { "$ref": "#/definitions/lektionPackage" }
    }
  },
  "definitions": {
    "lektionPackage": {
      "type": "object",
      "required": ["lektionId", "level", "modulNumber", "lektionNumber", "title", "grammarFocus", "vocabulary", "practice", "test"],
      "properties": {
        "lektionId": { "type": "string" },
        "level": { "enum": ["A1", "A2", "B1", "B1+"] },
        "modulNumber": { "type": "integer", "minimum": 1, "maximum": 8 },
        "lektionNumber": { "type": "integer", "minimum": 1, "maximum": 24 },
        "title": { "type": "string" },
        "grammarFocus": {
          "type": "array",
          "items": { "type": "string" }
        },
        "vocabulary": {
          "type": "array",
          "minItems": 15,
          "maxItems": 30,
          "items": { "$ref": "#/definitions/vocabularyItem" }
        },
        "practice": {
          "type": "object",
          "description": "Merges both source books into one pool: `easy` draws on Kursbuch's thematic/contextual exercises, `medium`/`hard` on the Arbeitsbuch's native leicht/schwer drill tiers.",
          "required": ["easy", "medium", "hard"],
          "properties": {
            "easy": { "type": "array", "minItems": 10, "maxItems": 15, "items": { "$ref": "#/definitions/exerciseItem" } },
            "medium": { "type": "array", "minItems": 10, "maxItems": 15, "items": { "$ref": "#/definitions/exerciseItem" } },
            "hard": { "type": "array", "minItems": 10, "maxItems": 15, "items": { "$ref": "#/definitions/exerciseItem" } }
          }
        },
        "test": {
          "type": "array",
          "description": "Direct Test Mode's item bank — a separate, originally-authored assessment, never reachable through `practice` and never gated by it.",
          "minItems": 10,
          "maxItems": 20,
          "items": { "$ref": "#/definitions/exerciseItem" }
        }
      }
    },
    "vocabularyItem": {
      "type": "object",
      "required": ["id", "term", "translation", "partOfSpeech", "example"],
      "properties": {
        "id": { "type": "string" },
        "term": { "type": "string" },
        "translation": { "type": "string" },
        "partOfSpeech": { "enum": ["noun", "verb", "adjective", "adverb", "phrase"] },
        "gender": { "enum": ["der", "die", "das", null] },
        "plural": { "type": "string" },
        "example": { "type": "string" },
        "preterite": { "type": "string" },
        "participle": { "type": "string" },
        "auxiliary": { "enum": ["haben", "sein"] },
        "irregular": { "type": "boolean" }
      }
    },
    "exerciseItem": {
      "type": "object",
      "required": ["id", "type", "instruction", "prompt", "solution", "explanation"],
      "properties": {
        "id": { "type": "string" },
        "type": {
          "enum": [
            "multiple-choice",
            "fill-in-blank",
            "sentence-scramble",
            "cloze-conjugation",
            "targeted-transformation",
            "error-correction"
          ]
        },
        "instruction": { "type": "string" },
        "prompt": { "type": "string" },
        "options": { "type": "array", "items": { "type": "string" } },
        "scrambleChunks": { "type": "array", "items": { "type": "string" } },
        "solution": { "type": "string" },
        "hint": { "type": "string" },
        "explanation": { "type": "string" }
      }
    }
  }
}
