{
  "modulId": "a1-m3",
  "level": "A1",
  "modulNumber": 3,
  "title": "Freizeit und Essen",
  "lektionen": [
    {
      "lektionId": "a1-m3-l7",
      "level": "A1",
      "modulNumber": 3,
      "lektionNumber": 7,
      "title": "Hobbys",
      "grammarFocus": [
        "Verben der Freizeit im Präsens",
        "Gradadverbien: gut, sehr gut, nicht so gut, gar nicht"
      ],
      "vocabulary": [
        { "id": "l7v01", "term": "schwimmen", "translation": "nadar", "partOfSpeech": "verb", "preterite": "schwamm", "participle": "geschwommen", "auxiliary": "haben", "irregular": true, "example": "Ich schwimme gut." },
        { "id": "l7v02", "term": "Gitarre spielen", "translation": "tocar la guitarra", "partOfSpeech": "phrase", "example": "Ich spiele Gitarre." },
        { "id": "l7v03", "term": "backen", "translation": "hornear", "partOfSpeech": "verb", "preterite": "backte", "participle": "gebacken", "auxiliary": "haben", "irregular": true, "example": "Ich backe gern." },
        { "id": "l7v04", "term": "malen", "translation": "pintar", "partOfSpeech": "verb", "preterite": "malte", "participle": "gemalt", "auxiliary": "haben", "irregular": false, "example": "Ich male ein bisschen." },
        { "id": "l7v05", "term": "tanzen", "translation": "bailar", "partOfSpeech": "verb", "preterite": "tanzte", "participle": "getanzt", "auxiliary": "haben", "irregular": false, "example": "Ich tanze sehr gut." },
        { "id": "l7v06", "term": "Fußball spielen", "translation": "jugar al fútbol", "partOfSpeech": "phrase", "example": "Ich spiele Fußball." },
        { "id": "l7v07", "term": "singen", "translation": "cantar", "partOfSpeech": "verb", "preterite": "sang", "participle": "gesungen", "auxiliary": "haben", "irregular": true, "example": "Ich singe nicht so gut." },
        { "id": "l7v08", "term": "das Hobby", "translation": "el pasatiempo", "partOfSpeech": "noun", "gender": "das", "plural": "die Hobbys", "example": "Mein Hobby ist Malen." },
        { "id": "l7v09", "term": "gut", "translation": "bien", "partOfSpeech": "adverb", "example": "Ich schwimme gut." },
        { "id": "l7v10", "term": "nicht so gut", "translation": "no tan bien", "partOfSpeech": "phrase", "example": "Ich singe nicht so gut." },
        { "id": "l7v11", "term": "gar nicht", "translation": "nada (en absoluto)", "partOfSpeech": "phrase", "example": "Ich tanze gar nicht." },
        { "id": "l7v12", "term": "sehr gut", "translation": "muy bien", "partOfSpeech": "phrase", "example": "Ich tanze sehr gut." },
        { "id": "l7v13", "term": "ein bisschen", "translation": "un poco", "partOfSpeech": "phrase", "example": "Ich male ein bisschen." },
        { "id": "l7v14", "term": "toll", "translation": "genial", "partOfSpeech": "adjective", "example": "Das ist toll!" },
        { "id": "l7v15", "term": "super", "translation": "súper", "partOfSpeech": "adjective", "example": "Fußball spielen super." },
        { "id": "l7v16", "term": "finden", "translation": "opinar / encontrar", "partOfSpeech": "verb", "preterite": "fand", "participle": "gefunden", "auxiliary": "haben", "irregular": true, "example": "Erika findet das toll." }
      ],
      "practice": {
        "easy": [
          { "id": "l7e01", "type": "multiple-choice", "instruction": "Wähle die richtige Verbform.", "prompt": "Ich ___ gut. (schwimmen)", "options": ["schwimme", "schwimmst", "schwimmt", "schwimmen"], "solution": "schwimme", "hint": "'ich'-Form.", "explanation": "Die 'ich'-Form von 'schwimmen' lautet 'schwimme'." },
          { "id": "l7e02", "type": "multiple-choice", "instruction": "Wähle die richtige Verbform.", "prompt": "Ich ___ Gitarre. (spielen)", "options": ["spiele", "spielst", "spielt", "spielen"], "solution": "spiele", "hint": "'ich'-Form.", "explanation": "Die 'ich'-Form von 'spielen' lautet 'spiele'." },
          { "id": "l7e03", "type": "multiple-choice", "instruction": "Wähle die richtige Verbform.", "prompt": "Ich ___ gern. (backen)", "options": ["backe", "bäckst", "backt", "backen"], "solution": "backe", "hint": "'ich'-Form.", "explanation": "Die 'ich'-Form von 'backen' lautet 'backe'." },
          { "id": "l7e04", "type": "multiple-choice", "instruction": "Wähle die richtige Verbform.", "prompt": "Ich ___ ein bisschen. (malen)", "options": ["male", "malst", "malt", "malen"], "solution": "male", "hint": "'ich'-Form.", "explanation": "Die 'ich'-Form von 'malen' lautet 'male'." },
          { "id": "l7e05", "type": "multiple-choice", "instruction": "Wähle die richtige Verbform.", "prompt": "Ich ___ sehr gut. (tanzen)", "options": ["tanze", "tanzt", "tanzst", "tanzen"], "solution": "tanze", "hint": "'ich'-Form.", "explanation": "Die 'ich'-Form von 'tanzen' lautet 'tanze'." },
          { "id": "l7e06", "type": "multiple-choice", "instruction": "Wähle die passende Angabe.", "prompt": "Ich kann keine Note treffen. Ich singe ___.", "options": ["nicht so gut", "sehr gut", "gut", "toll"], "solution": "nicht so gut", "hint": "Negative Selbsteinschätzung.", "explanation": "'nicht so gut' passt zu einer schwachen Fähigkeit." },
          { "id": "l7e07", "type": "multiple-choice", "instruction": "Wähle das Wort für 'genial'.", "prompt": "Das ist ___!", "options": ["toll", "backen", "malen", "singen"], "solution": "toll", "hint": "Achte auf die Bedeutung, nicht nur auf die Wortart.", "explanation": "'toll' bedeutet 'genial' und drückt Begeisterung aus." },
          { "id": "l7e08", "type": "fill-in-blank", "instruction": "Ergänze das Nomen.", "prompt": "Mein ___ ist Malen. (Hobby)", "solution": "Hobby", "hint": "Ein Substantiv.", "explanation": "'Hobby' ist das gesuchte Substantiv." },
          { "id": "l7e09", "type": "fill-in-blank", "instruction": "Ergänze das Verb.", "prompt": "Ich ___ Fußball. (spielen)", "solution": "spiele", "hint": "'ich'-Form.", "explanation": "Die 'ich'-Form von 'spielen' lautet 'spiele'." },
          { "id": "l7e10", "type": "multiple-choice", "instruction": "Wähle die richtige Verbform.", "prompt": "Erika ___ das toll. (finden)", "options": ["findet", "finde", "findest", "finden"], "solution": "findet", "hint": "3. Person Singular.", "explanation": "Die 'sie'-Form von 'finden' lautet 'findet'." }
        ],
        "medium": [
          { "id": "l7m01", "type": "sentence-scramble", "instruction": "Bilde einen Satz.", "prompt": "Baue den Satz aus den Wörtern.", "scrambleChunks": ["Ich", "schwimme", "gut"], "solution": "Ich schwimme gut.", "hint": "Verb an Position 2.", "explanation": "Das konjugierte Verb steht an Position 2." },
          { "id": "l7m02", "type": "sentence-scramble", "instruction": "Bilde einen Satz.", "prompt": "Baue den Satz aus den Wörtern.", "scrambleChunks": ["Ich", "spiele", "Gitarre"], "solution": "Ich spiele Gitarre.", "hint": "Verb an Position 2.", "explanation": "Das konjugierte Verb steht an Position 2." },
          { "id": "l7m03", "type": "sentence-scramble", "instruction": "Bilde einen Satz.", "prompt": "Baue den Satz aus den Wörtern.", "scrambleChunks": ["Ich", "tanze", "sehr", "gut"], "solution": "Ich tanze sehr gut.", "hint": "Verb an Position 2.", "explanation": "Das konjugierte Verb steht an Position 2." },
          { "id": "l7m04", "type": "sentence-scramble", "instruction": "Bilde einen Satz.", "prompt": "Baue den Satz aus den Wörtern.", "scrambleChunks": ["Ich", "singe", "nicht", "so", "gut"], "solution": "Ich singe nicht so gut.", "hint": "Verb an Position 2.", "explanation": "Das konjugierte Verb steht an Position 2." },
          { "id": "l7m05", "type": "sentence-scramble", "instruction": "Bilde einen Satz.", "prompt": "Baue den Satz aus den Wörtern.", "scrambleChunks": ["Ich", "male", "ein", "bisschen"], "solution": "Ich male ein bisschen.", "hint": "Verb an Position 2.", "explanation": "Das konjugierte Verb steht an Position 2." },
          { "id": "l7m06", "type": "sentence-scramble", "instruction": "Bilde einen Satz.", "prompt": "Baue den Satz aus den Wörtern.", "scrambleChunks": ["Erika", "findet", "das", "toll"], "solution": "Erika findet das toll.", "hint": "Verb an Position 2.", "explanation": "Das konjugierte Verb steht an Position 2." },
          { "id": "l7m07", "type": "cloze-conjugation", "instruction": "Konjugiere das Verb in Klammern.", "prompt": "Du ___ (schwimmen) gut.", "solution": "schwimmst", "hint": "'du'-Form.", "explanation": "Die 'du'-Form von 'schwimmen' lautet 'schwimmst'." },
          { "id": "l7m08", "type": "cloze-conjugation", "instruction": "Konjugiere das Verb in Klammern.", "prompt": "Er ___ (backen) gern.", "solution": "backt", "hint": "3. Person Singular.", "explanation": "Die 'er'-Form von 'backen' lautet 'backt'." },
          { "id": "l7m09", "type": "cloze-conjugation", "instruction": "Konjugiere das Verb in Klammern.", "prompt": "Wir ___ (tanzen) gern.", "solution": "tanzen", "hint": "'wir'-Form.", "explanation": "Die 'wir'-Form von 'tanzen' lautet 'tanzen'." },
          { "id": "l7m10", "type": "cloze-conjugation", "instruction": "Konjugiere das Verb in Klammern.", "prompt": "Sie ___ (singen) sehr gut.", "solution": "singt", "hint": "3. Person Singular.", "explanation": "Die 'sie'-Form von 'singen' lautet 'singt'." }
        ],
        "hard": [
          { "id": "l7h01", "type": "targeted-transformation", "instruction": "Sage, dass du gut schwimmst.", "prompt": "gut / schwimmen", "solution": "Ich schwimme gut.", "hint": "'ich'-Form.", "explanation": "Die 'ich'-Form von 'schwimmen' lautet 'schwimme'." },
          { "id": "l7h02", "type": "targeted-transformation", "instruction": "Sage, dass du gar nicht tanzt.", "prompt": "gar nicht / tanzen", "solution": "Ich tanze gar nicht.", "hint": "'ich'-Form.", "explanation": "Die 'ich'-Form von 'tanzen' lautet 'tanze'." },